{
  "cases": {
    "f16": {
      "autofit_uma": {
        "command": [
          "/workspace/k3-out-of-core/llama.cpp/build-phase11-a-cuda/bin/phase11-uma-runtime-probe",
          "--model",
          "/workspace/k3-out-of-core/models/gguf/Kimi-K3-0.40B-F16.gguf",
          "--mode",
          "uma",
          "--steps",
          "10",
          "--capacity",
          "2",
          "--cold-bytes",
          "0",
          "--ring-bytes",
          "0"
        ],
        "diagnostics": {
          "cold_actual_bytes": 44040192,
          "cold_alignment": 4096,
          "cold_bundle_payload": 786432,
          "cold_evictions": 0,
          "cold_failed_cleanups": 0,
          "cold_failed_copies": 0,
          "cold_generation_changes": 51,
          "cold_hits": 145,
          "cold_hot_refs": 2,
          "cold_misses": 51,
          "cold_peak_hot_refs": 2,
          "cold_peak_request_refs": 2,
          "cold_peak_transfer_refs": 0,
          "cold_policy": 0,
          "cold_policy_admission": 0,
          "cold_policy_digest": 14479363227805012875,
          "cold_policy_drops": 0,
          "cold_policy_scope": 0,
          "cold_reclaim_failures": 0,
          "cold_reclaimed_bytes": 0,
          "cold_request_refs": 0,
          "cold_requested_bytes": 44040192,
          "cold_slot_footprint": 786432,
          "cold_slots": 56,
          "cold_source_bytes": 0,
          "cold_source_time_us": 0,
          "cold_transfer_refs": 0,
          "cold_unused_bytes": 0,
          "decode_tokens_per_second": 41.3687,
          "disk_h2d_overlap_bytes": 0,
          "disk_h2d_overlap_events": 0,
          "disk_h2d_overlap_flights": 0,
          "disk_h2d_overlap_pair_digest": 0,
          "disk_h2d_overlap_pairs": 0,
          "disk_h2d_overlap_read_bytes": 0,
          "disk_h2d_overlap_read_flights": 0,
          "disk_h2d_overlap_transfer_flights": 0,
          "disk_h2d_overlap_us": 0,
          "execution_backend_device_type": 2,
          "execution_ids_backend_consistent": 1,
          "execution_ids_backend_device_type": 0,
          "execution_ids_backend_name": "CPU",
          "execution_ids_cpu": 98,
          "execution_ids_non_cpu": 0,
          "h2d_compute_overlap_bytes": 0,
          "h2d_compute_overlap_flights": 0,
          "h2d_compute_overlap_us": 0,
          "h2d_compute_overlap_work": 0,
          "hot_admissions": 0,
          "hot_effective_capacity": 2,
          "hot_evictions": 194,
          "hot_hits": 0,
          "hot_misses": 0,
          "hot_policy": 0,
          "hot_policy_admission": 0,
          "hot_policy_digest": 16724702958453942945,
          "hot_policy_drops": 0,
          "hot_policy_scope": 0,
          "hot_requested_capacity": 2,
          "hot_slots": 0,
          "io_active_operations": 0,
          "io_active_requests": 0,
          "io_async": 0,
          "io_buffer_registration_error": 0,
          "io_buffered_fallback_bytes": 0,
          "io_buffered_fallback_operations": 0,
          "io_bytes": 0,
          "io_cq_entries": 0,
          "io_direct_aligned_bytes": 0,
          "io_direct_capability_retries": 0,
          "io_direct_operations": 0,
          "io_direct_scatter_bytes": 0,
          "io_direct_staging_error": 0,
          "io_direct_useful_bytes": 0,
          "io_file_registration_error": 0,
          "io_operations": 0,
          "io_peak_batch_requests": 0,
          "io_peak_cq_occupancy": 0,
          "io_peak_sq_occupancy": 0,
          "io_probe_error": 0,
          "io_registered_buffer_bytes": 0,
          "io_registered_buffers": 0,
          "io_registered_files": 0,
          "io_request_batches": 0,
          "io_requests": 0,
          "io_runtime_error": 0,
          "io_setup_error": 1,
          "io_sq_entries": 0,
          "io_sync_fallback_operations": 0,
          "io_trace_dropped": 0,
          "load_mode": "mmap",
          "logits_hash": 10815777271364060946,
          "mode": "uma",
          "no_writeback_evictions": 0,
          "prompt_ids": "18805,308,799,5624,12524",
          "prompt_tokens_per_second": 23.1257,
          "provider_effective_capacity": 56,
          "provider_failures": 0,
          "provider_pool_bytes": 44040192,
          "provider_pool_generations": 1,
          "provider_tensor_copies": 0,
          "resident_runtime_quiet": 1,
          "ring_acquisition": "",
          "ring_actual_bytes": 0,
          "ring_async_enqueues": 0,
          "ring_compute_event_allocations": 0,
          "ring_compute_event_capacity": 0,
          "ring_compute_event_frees": 0,
          "ring_compute_event_records": 0,
          "ring_compute_event_syncs": 0,
          "ring_compute_waits": 0,
          "ring_compute_work": 0,
          "ring_dedicated_backend": 0,
          "ring_event_capable": 0,
          "ring_event_capacity": 0,
          "ring_event_records": 0,
          "ring_event_syncs": 0,
          "ring_fallback": 0,
          "ring_fallback_reason": "",
          "ring_first_h2d_us": 0,
          "ring_h2d_bytes": 0,
          "ring_h2d_event_allocations": 0,
          "ring_h2d_event_capacity": 0,
          "ring_h2d_event_frees": 0,
          "ring_h2d_time_us": 0,
          "ring_lane_footprint": 0,
          "ring_lanes": 0,
          "ring_last_h2d_complete_us": 0,
          "ring_live_compute_events": 0,
          "ring_live_events": 0,
          "ring_live_h2d_events": 0,
          "ring_peak_live_compute_events": 0,
          "ring_peak_live_events": 0,
          "ring_peak_live_h2d_events": 0,
          "ring_pinned_bytes": 0,
          "ring_requested_bytes": 0,
          "ring_stage_bytes": 0,
          "ring_stage_time_us": 0,
          "ring_sync_copies": 0,
          "ring_trace_capacity": 0,
          "ring_trace_dropped": 0,
          "ring_trace_records": 0,
          "ring_wave_syncs": 0,
          "ring_waves": 0,
          "route_hash": 2076412580634775498,
          "route_records": 98,
          "routing_backend_consistent": 1,
          "routing_backend_device_type": 2,
          "routing_backend_name": "CUDA0",
          "routing_ids_cpu": 0,
          "routing_ids_non_cpu": 98,
          "scheduler_active": 0,
          "scheduler_flights": 51,
          "source_pageable": 1,
          "source_pinned_bytes": 0,
          "storage_cancelled_reads": 0,
          "storage_direct_alignment": 0,
          "storage_direct_sources": 0,
          "storage_direct_unsupported": 0,
          "storage_integrity_checks": 51,
          "storage_integrity_mismatches": 0,
          "storage_io_errors": 0,
          "storage_poisoned": 0,
          "storage_read_bytes": 40108032,
          "storage_read_chunks": 153,
          "storage_read_requests": 51,
          "storage_short_reads": 0,
          "token_p50_us": 24154,
          "token_p95_us": 216210,
          "token_p99_us": 216210,
          "tokens": "318,57195,11,1459,387,1495,2189,261,56207,1765",
          "ttft_us": 216210,
          "uma_autofit": 1,
          "uma_cgroup_memory_current_bytes": 14214209536,
          "uma_cgroup_memory_max_bytes": 125371940864,
          "uma_degraded_hits": 0,
          "uma_effective_pool_bytes": 44040192,
          "uma_headroom_remainder_bytes": 551321,
          "uma_major_faults": 0,
          "uma_memory_available_bytes": 124707446784,
          "uma_nvidia_hmm_counters_supported": 0,
          "uma_nvidia_hmm_status_reason": "unsupported: no stable per-process NVIDIA HMM fault counter exposed",
          "uma_physical_ram_bytes": 130596102144,
          "uma_prepared_cold_hits": 145,
          "uma_pressure_circuit_open": 0,
          "uma_pressure_rejections": 0,
          "uma_pressure_samples": 51,
          "uma_process_rss_bytes": 495820800,
          "uma_process_swap_bytes": 0,
          "uma_psi_full_supported": 1,
          "uma_psi_full_total_usec": 8216,
          "uma_resident_hot_hits": 0,
          "uma_runtime_delta_bytes": 672896,
          "uma_runtime_reserve_bytes": 17179869184,
          "uma_safe_pool_bytes": 81534124032,
          "uma_storage_misses": 51,
          "uma_swap_counters_supported": 1,
          "uma_system_reserve_bytes": 12537194087,
          "uma_telemetry_unavailable_reason": "",
          "uma_unknown_residency_hits": 0,
          "uma_zram_counters_supported": 0,
          "uma_zram_present": 0,
          "uma_zram_status_reason": "unsupported: no zram block device",
          "uma_zram_write_bytes": 0,
          "uma_zswap_counters_supported": 0,
          "uma_zswap_enabled": 0,
          "uma_zswap_status_reason": "unsupported: zswap disabled",
          "uma_zswap_write_pages": 0
        },
        "stderr_sha256": "f884606baf076e45263d9ab5a2eda1a8fcca02639bdafca5a87bb0910ae977b7",
        "stdout_sha256": "3a4cb3a33f328d04054579c846c72c948c2b23a81fb068d088d9fd3031c6a837"
      },
      "baseline": {
        "command": [
          "/workspace/k3-out-of-core/llama.cpp/build-phase11-a-cuda/bin/phase11-uma-runtime-probe",
          "--model",
          "/workspace/k3-out-of-core/models/gguf/Kimi-K3-0.40B-F16.gguf",
          "--mode",
          "disabled",
          "--steps",
          "10"
        ],
        "diagnostics": {
          "cold_actual_bytes": 0,
          "cold_alignment": 0,
          "cold_bundle_payload": 0,
          "cold_evictions": 0,
          "cold_failed_cleanups": 0,
          "cold_failed_copies": 0,
          "cold_generation_changes": 0,
          "cold_hits": 0,
          "cold_hot_refs": 0,
          "cold_misses": 0,
          "cold_peak_hot_refs": 0,
          "cold_peak_request_refs": 0,
          "cold_peak_transfer_refs": 0,
          "cold_policy": 0,
          "cold_policy_admission": 0,
          "cold_policy_digest": 0,
          "cold_policy_drops": 0,
          "cold_policy_scope": 0,
          "cold_reclaim_failures": 0,
          "cold_reclaimed_bytes": 0,
          "cold_request_refs": 0,
          "cold_requested_bytes": 0,
          "cold_slot_footprint": 0,